{
  "id": "map-math-nani-v3",
  "subject": "math",
  "knowledgeId": "kg-math-learning-content",
  "publisher": "nani",
  "edition": {
    "academicYear": "115",
    "grade": "8",
    "volume": "3"
  },
  "textbookLocation": {
    "chapterLabel": "整冊（冊別存在性基線）",
    "unitLabel": "第3冊"
  },
  "relation": "supporting",
  "evidence": {
    "type": "official-government-list",
    "url": "https://textbooks.naer.edu.tw/DownLoadFile.aspx?ASParam=TUZIRSs3NSUyNjglMjQlN2QlMWIlMDR1eSUwZWdocCU3ZWZ3JTExd20lMWN1JTBiJTBjJTFiZm4lMDAlMTIlN2V3ZnQlMDMlMWVwJTBiJTBjJTA2JTFkJTFldg%3D%3D",
    "locator": "115學年度國民中學教科用書清冊；數學；第3冊；適用8年級；出版者 南一",
    "verifiedAt": "2026-08-25",
    "verifiedBy": "ChatGPT official-source verification",
    "confidence": "high"
  },
  "status": "verified",
  "notes": "整冊存在性基線 mapping；尚未細分到章節／單元與細粒度 KG 節點。"
}
